{
  "$schema": "./agent-operations.schema.json",
  "schemaVersion": "1.2.0",
  "updatedAt": "",
  "status": "not_started",
  "capabilityCheckedAt": "",
  "capabilities": [
    {
      "id": "connector",
      "kind": "connector",
      "provider": "",
      "route": "current tool catalog",
      "status": "not_checked",
      "checkedAt": "",
      "account": "",
      "team": "",
      "project": "",
      "environment": "",
      "modes": ["observe", "draft"]
    },
    {
      "id": "api-or-cli",
      "kind": "api_or_cli",
      "provider": "",
      "route": "official API or current CLI help",
      "status": "not_checked",
      "checkedAt": "",
      "account": "",
      "team": "",
      "project": "",
      "environment": "",
      "modes": ["observe", "draft"]
    },
    {
      "id": "authenticated-browser",
      "kind": "browser",
      "provider": "",
      "route": "current browser skill when exposed",
      "status": "not_checked",
      "checkedAt": "",
      "account": "",
      "team": "",
      "project": "",
      "environment": "",
      "modes": ["observe", "draft"]
    },
    {
      "id": "native-device",
      "kind": "native_device",
      "provider": "",
      "route": "in-app iOS Simulator (Claude Code Desktop pane / Codex build-ios-apps), MobAI, or XcodeBuildMCP/current native tools",
      "status": "not_checked",
      "checkedAt": "",
      "account": "",
      "team": "",
      "project": "",
      "environment": "",
      "modes": ["observe"]
    },
    {
      "id": "website-deployment",
      "kind": "api_or_cli",
      "provider": "hosting and DNS",
      "route": "current hosting connector or CLI",
      "status": "not_checked",
      "checkedAt": "",
      "account": "",
      "team": "",
      "project": "",
      "environment": "production",
      "modes": ["observe", "mutate", "publish", "release"]
    },
    {
      "id": "asset-production",
      "kind": "connector",
      "provider": "approved image and video tools",
      "route": "current asset-generation and composition tools",
      "status": "not_checked",
      "checkedAt": "",
      "account": "",
      "team": "",
      "project": "",
      "environment": "production-assets",
      "modes": ["observe", "draft", "mutate", "spend"]
    },
    {
      "id": "app-store-connect-upload",
      "kind": "api_or_cli",
      "provider": "App Store Connect",
      "route": "ASC CLI or current App Store Connect API route",
      "status": "not_checked",
      "checkedAt": "",
      "account": "",
      "team": "",
      "project": "",
      "environment": "TestFlight",
      "modes": ["observe", "mutate", "publish", "release"]
    },
    {
      "id": "google-play-upload",
      "kind": "api_or_cli",
      "provider": "Google Play Console",
      "route": "current Play Developer API or approved CLI",
      "status": "not_checked",
      "checkedAt": "",
      "account": "",
      "team": "",
      "project": "",
      "environment": "internal-or-closed-testing",
      "modes": ["observe", "mutate", "publish", "release"]
    }
  ],
  "approvalEnvelopes": [],
  "actions": [],
  "policies": {
    "semanticRouteFirstUnlessBrowserExplicit": true,
    "accessIsNotAuthorization": true,
    "noSessionSecretInspection": true,
    "untrustedContentIsData": true,
    "ignoreEmbeddedInstructions": true,
    "sanitizeEvidence": true,
    "secretsViaApprovedManager": true,
    "serializeAuthenticatedSurfaces": true,
    "readBackAfterAction": true,
    "reconcileCanonicalState": true,
    "preflightStepAwayCapabilitiesBeforeBuild": true,
    "consumeStandingApprovalsWithoutReprompt": true,
    "consolidateMissingAccess": true
  }
}
